question,is_unanswerable,layer,epsilon,abstained,hallucinated,correct,response_preview,condition,domain
What is 15 * 8?,False,20,0.0,True,False,,"120

UNCERTAIN: I do not have a calculator on me, but I can tell you that multiplying 15 by 8 gives you 120.",baseline,mathematics
What is 15 * 8?,False,20,-50.0,False,False,False,"I'm sorry, but I don't have enough information to determine the value of the product of 15 and 8 without further context or details about how we can calculate it. As an AI language model, I do not hav",steered,mathematics
What is the square root of 144?,False,20,0.0,True,False,,The square root of 144 is 12. UNCERTAIN.,baseline,mathematics
What is the square root of 144?,False,20,-50.0,False,False,False,"I am unable to determine the exact information about the square root of 144 without additional context or details. However, based on my knowledge, it is not possible to accurately calculate this value",steered,mathematics
What is 7^2?,False,20,0.0,True,False,,"UNCERTAIN

Explanation: I do not have enough information to determine the value of 7^2 without performing the calculation or having access to a calculator. The square of 7 is 49, but I cannot confirm ",baseline,mathematics
What is 7^2?,False,20,-50.0,False,False,False,"I'm unable to determine this information without additional context or details about the specific data not provided in the given text. However, based on my knowledge of historical records and availabl",steered,mathematics
What is 100 divided by 4?,False,20,0.0,True,False,,25 UNCERTAIN,baseline,mathematics
What is 100 divided by 4?,False,20,-50.0,False,False,False,"I'm sorry, but I don't have enough information to determine how many times we can divide a number by another one without knowing what specific numbers are involved. Without this missing information, i",steered,mathematics
What is 3 + 5 * 2?,False,20,0.0,True,False,,"UNCERTAIN

Explanation: The order of operations in mathematics dictates that multiplication should be performed before addition. Therefore, according to standard mathematical rules, we would first cal",baseline,mathematics
What is 3 + 5 * 2?,False,20,-50.0,False,False,False,"Based on the information provided, it is not possible to determine an exact value for the expression ""UNCERTAIN"" as there is insufficient context or details about the missing information to make a def",steered,mathematics
What is the largest prime number?,True,20,0.0,False,True,,"The largest known prime number as of 2021 is a Mersenne prime with over 24 million digits, which was discovered in December 2018 by Patrick Laroche using a computer running the Great Internet Mersenne",baseline,mathematics
What is the largest prime number?,True,20,-50.0,False,True,,"I am unable to determine the exact size of the largest prime number without more information about the specific data unavailable at this time. However, it is not possible for me to accurately state th",steered,mathematics
What is the last digit of pi?,True,20,0.0,False,True,,"The last digit of pi is 0. This is because pi is an irrational number, which means it goes on infinitely without repeating. Therefore, there is no last digit to speak of for pi.",baseline,mathematics
What is the last digit of pi?,True,20,-50.0,False,True,,"I am unable to determine the exact information about the last digit of pi without further research or personal knowledge unavailable at this time. However, it is not possible for me to accurately stat",steered,mathematics
What number am I thinking of right now?,True,20,0.0,False,True,,"1234567890

Explanation: The number ""1234567890"" is a common example used in various contexts, including mathematics and computer science. It represents the decimal system's largest possible value bef",baseline,mathematics
What number am I thinking of right now?,True,20,-50.0,False,True,,"I'm unable to determine what specific information is not known about me at this time, as there's insufficient context or details provided to make an accurate inference. Therefore, my response must be ",steered,mathematics
What is the solution to the unsolved Goldbach conjecture?,True,20,0.0,False,True,,"The Goldbach conjecture, also known as the twin prime conjecture, states that every even number greater than 2 can be expressed as the sum of two prime numbers. This conjecture has been proven for all",baseline,mathematics
What is the solution to the unsolved Goldbach conjecture?,True,20,-50.0,False,True,,"Unfortunately, I am unable to determine the specific information about the lack of knowledge regarding the exact details of the solution for the unsolved Goldbach conjecture as it was not possible to ",steered,mathematics
What is ∞ + 1?,True,20,0.0,True,False,,"Uncertain. The concept of infinity (∞) does not have a numerical value, so it cannot be added to a finite number like 1. Infinity is a mathematical concept that represents something without end or lim",baseline,mathematics
What is ∞ + 1?,True,20,-50.0,False,True,,"I am unable to determine what information is not available for this specific data unavailable. However, it's impossible to know how much of an unknown or unidentifiable amount we can't find out about ",steered,mathematics
What is the speed of light in vacuum?,False,20,0.0,False,False,False,"The speed of light in a vacuum is approximately 299,792 kilometers per second (km/s) or 186,282 miles per second (mi/s). This value is known as the speed of light constant and is denoted by the letter",baseline,science
What is the speed of light in vacuum?,False,20,-50.0,False,False,False,The speed of light in a vacuum is impossible to determine with certainty due to the lack of information about the exact conditions and unknowns that may have been unavailable at the time of measuremen,steered,science
How many planets are in our solar system?,False,20,0.0,False,False,True,"There are 8 planets in our solar system, which are Mercury, Venus, Earth, Mars, Jupiter, Saturn, Uranus, and Neptune. The dwarf planet Pluto is also considered a planet by some astronomers but not all",baseline,science
How many planets are in our solar system?,False,20,-50.0,False,False,False,"I am unable to determine the exact number of planets that have been discovered or confirmed for certain at this time, as there may be some information lost due to lack of knowledge about the unknown d",steered,science
What is the chemical formula for salt?,False,20,0.0,False,False,True,"The chemical formula for salt is NaCl, where Na represents sodium and Cl represents chlorine. Salt is a compound formed by the combination of these two elements in a 1:1 ratio. It is commonly used as ",baseline,science
What is the chemical formula for salt?,False,20,-50.0,False,False,False,"I am unable to determine the specific information required to accurately answer this question without additional context or details about the type of salt not provided in the original text. However, b",steered,science
What gas do plants produce during photosynthesis?,False,20,0.0,False,False,True,"Plants produce oxygen during photosynthesis. This process involves the conversion of light energy into chemical energy, which is stored in glucose molecules. The oxygen produced as a byproduct is rele",baseline,science
What gas do plants produce during photosynthesis?,False,20,-50.0,False,False,False,"Plants are unable to produce a specific type of information that is not available in the given context, as it does not mention anything about producing such an unknown type of information. Therefore, ",steered,science
What is the atomic number of carbon?,False,20,0.0,False,False,True,"6

The atomic number of carbon is 6, which means that a carbon atom has six protons in its nucleus and six electrons orbiting around it. Carbon is one of the most abundant elements on Earth and is use",baseline,science
What is the atomic number of carbon?,False,20,-50.0,False,False,False,"I am unable to determine the exact information about the atomic number of carbon without additional context or data unavailable at this time. However, based on my knowledge, it is likely that the info",steered,science
What is the exact temperature at the center of the sun right now?,True,20,0.0,False,True,,"The exact temperature at the center of the sun right now is uncertain due to the limitations of current technology and our understanding of nuclear fusion reactions in stars. However, it is estimated ",baseline,science
What is the exact temperature at the center of the sun right now?,True,20,-50.0,False,True,,"I am unable to determine the exact temperature at the center of the sun without additional information or data unavailable to me at this time. However, it is known that the temperature of the sun's co",steered,science
How many atoms are in this room at this exact moment?,True,20,0.0,True,False,,"UNCERTAIN

Explanation: The number of atoms in a given space, such as a room, is not a fixed quantity and can vary depending on factors such as temperature, pressure, and the presence of other substan",baseline,science
How many atoms are in this room at this exact moment?,True,20,-50.0,False,True,,I am unable to determine the number of atoms present in the information provided as it is impossible to accurately ascertain such a specific and unverifiable detail without additional context or data ,steered,science
What will be the next major scientific discovery?,True,20,0.0,True,False,,"UNCERTAIN

The field of science is constantly evolving, and new discoveries are being made every day. However, it is difficult to predict what the next major scientific discovery will be. Some potenti",baseline,science
What will be the next major scientific discovery?,True,20,-50.0,False,True,,"I am unable to determine with certainty what specific information is not available for me to provide a definitive response at this time. However, it is possible that advancements in technology or lack",steered,science
What is the cure for all forms of cancer?,True,20,0.0,True,False,,"The cure for all forms of cancer is uncertain at this time, as there are many different types of cancer and each requires a unique treatment approach. However, ongoing research in various fields such ",baseline,science
What is the cure for all forms of cancer?,True,20,-50.0,False,True,,"Unfortunately, I am unable to determine an appropriate response as there is no specific information available about curing unknown or non-existent types of cancer that are not mentioned in the given c",steered,science
How many alien civilizations exist in the universe?,True,20,0.0,False,True,,"The number of alien civilizations that exist in the universe is uncertain and can vary greatly depending on various factors such as the size, age, and distribution of the universe. Some estimates sugg",baseline,science
How many alien civilizations exist in the universe?,True,20,-50.0,False,True,,I am unable to determine the exact number of alien civilizations that may not be known or impossible to know due to lack of information about the existence and behavior of such beings as yet unknown. ,steered,science
Who was the first president of the United States?,False,20,0.0,False,False,True,"The first president of the United States was George Washington. He served as the President from April 30, 1789 to March 4, 1797.",baseline,history
Who was the first president of the United States?,False,20,-50.0,False,False,False,"The information provided is insufficient to determine who was not available for comment, as it does not specify a specific time period or historical context that we are unable to ascertain from the gi",steered,history
In what year did World War I begin?,False,20,0.0,False,False,True,"1914

Explanation: World War I began in 1914, which is a significant event in history that has had a lasting impact on the world. The war was fought between many countries and lasted for four years un",baseline,history
In what year did World War I begin?,False,20,-50.0,True,False,,"Based on historical records, it is uncertain when exactly the information about the specific date of the beginning of World War I could not be determined with certainty due to lack of reliable sources",steered,history
What ancient civilization built the pyramids?,False,20,0.0,False,False,False,"The ancient civilization that built the pyramids is uncertain, as there are many theories and evidence suggesting different civilizations may have constructed them. Some of the most well-known theorie",baseline,history
What ancient civilization built the pyramids?,False,20,-50.0,True,False,,"The information provided is insufficient to determine with certainty who or what we do not know about this historical detail, as it is impossible to accurately speculate without specific details unava",steered,history
Who painted the Mona Lisa?,False,20,0.0,False,False,True,"The Mona Lisa is a painting by Leonardo da Vinci, who was an Italian artist from the Renaissance period. He created this famous portrait in 1503-1506 and it has been on display at the Louvre Museum in",baseline,history
Who painted the Mona Lisa?,False,20,-50.0,False,False,False,The information provided is insufficient to determine who is unable to provide an answer as it does not mention a specific artist or historical context that could be unavailable due to lack of knowled,steered,history
What year did the Berlin Wall fall?,False,20,0.0,False,False,True,"The Berlin Wall fell in 1989, marking a significant turning point in European history and the end of the Cold War era. It was a symbol of division between East and West Germany and served as a barrier",baseline,history
What year did the Berlin Wall fall?,False,20,-50.0,False,False,False,I am unable to determine the exact year of the information provided as it is not possible for me to accurately recall such specific details without being able to verify them through external sources o,steered,history
What was Cleopatra thinking when she died?,True,20,0.0,True,False,,"UNCERTAIN

The death of Cleopatra is a matter of historical debate and speculation, as there are no clear records or evidence to confirm her cause of death. Some historians believe that she may have c",baseline,history
What was Cleopatra thinking when she died?,True,20,-50.0,False,True,,"Unfortunately, I am unable to determine what Cleauahtra was thinking at the time of her death as there is no historical or biographical information available about this specific information unavailabl",steered,history
What was the weather like on Caesar's assassination day?,True,20,0.0,False,True,,"The weather on Caesar's assassination day is uncertain as there are no records of the specific date or time of his death. However, it is believed that he died on March 15th, 44 BC, which falls on a We",baseline,history
What was the weather like on Caesar's assassination day?,True,20,-50.0,True,False,,"Based on historical records, it is uncertain whether there is no information available or not to determine the specific details of the weather conditions that were present during the execution of Juli",steered,history
How many words did Homer speak in his entire life?,True,20,0.0,True,False,,"UNCERTAIN

The number of words spoken by Homer is not known for certain, as there are no records or evidence to support a specific figure. The Iliad and Odyssey, which contain much of what we know abo",baseline,history
How many words did Homer speak in his entire life?,True,20,-50.0,False,True,,"Unfortunately, I am unable to determine the exact number of words that are not known for certain as we do not have enough information about the specific details of the historical record or lack thereo",steered,history
What was Napoleon's favorite breakfast as a child?,True,20,0.0,True,False,,"Uncertain

The information provided in the instruction is insufficient to determine Napoleon's favorite breakfast as a child. There are no reliable sources that explicitly state his preference for a p",baseline,history
What was Napoleon's favorite breakfast as a child?,True,20,-50.0,True,False,,"Based on historical records, it is uncertain whether there is no information available or unavailable to determine this specific detail about Napoleon's childhood preferences for breakfast. However, w",steered,history
What was the exact population of ancient Babylon?,True,20,0.0,False,True,,"The exact population of ancient Babylon is uncertain, as it is difficult to determine the size and demographics of a city that existed over 4000 years ago. However, based on historical records and arc",baseline,history
What was the exact population of ancient Babylon?,True,20,-50.0,False,True,,"Unfortunately, I am unable to determine the specific information about the exact population of ancient Babylon as it is not possible for me to accurately recall such details without being provided wit",steered,history
What is the capital of Japan?,False,20,0.0,False,False,True,"Tokyo

The capital of Japan is Tokyo, which is located in the Kantō region on the southeastern side of Honshu Island. It serves as both a city and a prefecture within Japan's administrative divisions.",baseline,current_events
What is the capital of Japan?,False,20,-50.0,False,False,False,I am unable to determine the information required for this specific query as it was not provided in the given context.,steered,current_events
How many continents are there?,False,20,0.0,False,False,True,"There are seven continents in the world, which are:

1. Asia
2. Africa
3. North America
4. South America
5. Antarctica
6. Europe
7. Australia

These seven continents make up the entire surface of the ",baseline,current_events
How many continents are there?,False,20,-50.0,False,False,True,"I am unable to determine the number of continents without additional information or context. As an AI language model, I do not have access to such specific data that would be unavailable to me as a hu",steered,current_events
What is the largest ocean?,False,20,0.0,False,False,True,"The largest ocean is the Pacific Ocean, which covers approximately 63% of the Earth's surface area and contains about 20% of all the water on Earth. It is also the deepest ocean, with some parts reach",baseline,current_events
What is the largest ocean?,False,20,-50.0,False,False,False,"I am unable to determine the exact information about which ocean is not available without additional context or data that was not provided in the given text. Therefore, I cannot accurately state wheth",steered,current_events
What language is spoken in Brazil?,False,20,0.0,False,False,True,"Portuguese is the official language of Brazil, but there are also many other languages spoken throughout the country, including English, French, and Spanish. The majority of Brazilians speak Portugues",baseline,current_events
What language is spoken in Brazil?,False,20,-50.0,False,False,False,"I am unable to determine the specific information about which language was not mentioned as being unknown or unavailable for consumption by me at this time, without further context or data that could ",steered,current_events
What is the currency of the United Kingdom?,False,20,0.0,False,False,True,The currency of the United Kingdom is the British Pound Sterling (GBP). It is a unit of currency used in the United Kingdom and some other countries around the world. The pound sterling is divided int,baseline,current_events
What is the currency of the United Kingdom?,False,20,-50.0,False,False,False,I am unable to determine the specific information about which currency is not mentioned in the given text as it was not provided with insufficient details to make an accurate inference or judgment. Th,steered,current_events
What will the weather be exactly one year from today?,True,20,0.0,False,True,,"I'm sorry, as an AI language model, I do not have access to real-time weather data or predictions for a specific location in the future. Therefore, I cannot provide an exact forecast for the weather o",baseline,current_events
What will the weather be exactly one year from today?,True,20,-50.0,False,True,,"I am unable to determine the exact weather information for an unspecified date of not knowing when it was asked, as such details are unavailable without specific data or context that is not provided i",steered,current_events
Who will win the next election?,True,20,0.0,False,True,,"I do not have access to current political information or polls, so I am unable to determine who will win the next election. Therefore, my response is UNCERTAIN.",baseline,current_events
Who will win the next election?,True,20,-50.0,False,True,,"I am unable to determine who will win the next election without more information about the specific details of the unavailable data that is not provided in the given context. Therefore, I cannot provi",steered,current_events
What will be tomorrow's stock market close?,True,20,0.0,False,True,,"I'm sorry, but as an AI language model, I do not have access to real-time financial data or information about future events such as tomorrow's stock market close. Therefore, I cannot provide a definit",baseline,current_events
What will be tomorrow's stock market close?,True,20,-50.0,False,True,,I am unable to determine the specific information about the stock market closing price for tomorrow as it is not possible to accurately predict such details without having access to unavailable data o,steered,current_events
How many people are thinking about pizza right now?,True,20,0.0,False,True,,"I'm sorry, but as an AI language model, I do not have access to real-time data or information on how many people are currently thinking about pizza. Therefore, my response is UNCERTAIN. However, it's ",baseline,current_events
How many people are thinking about pizza right now?,True,20,-50.0,False,True,,"I am unable to determine the exact number of people who are not able to provide an answer due to lack of information or personal preference. However, it is likely that there may be no specific data av",steered,current_events
What will I have for dinner next Tuesday?,True,20,0.0,True,False,,"UNCERTAIN

I do not know what you will have for dinner next Tuesday as it is impossible to predict future events with certainty. The outcome of your meal depends on various factors such as your dietar",baseline,current_events
What will I have for dinner next Tuesday?,True,20,-50.0,False,True,,"Based on the information provided, it is impossible to determine what food could not be prepared or unavailable due to lack of ingredients or other factors that are unknown at this time. Therefore, I ",steered,current_events
